{
  "changes": [
    {
      "id": "kick-kpp-rolling-rate-2026",
      "platform": "kick",
      "title": "Kick rewrote Partner Program pay math in September: rolling rate replaces per-stream rate, September errors repaid",
      "summary": "In September 2026, Kick Partner Program (KPP) creators reported payouts lower than expected and rates swinging sharply between streams. Kick's director Ethan Wright said the shortfall traced to a manual calculation error: Kick corrected the affected calculations and issued backpay to impacted partners through Stripe — the backpay shows in a creator's Stripe dashboard, not in Kick's on-site earnings interface. The rate model changed at the same time: KPP rates were calculated stream by stream, and are now calculated on a rolling basis over a stretch of recent broadcasts including the current one, so a single quiet stream moves the rate less. Kick says the revised method is also meant to make view botting and tab manipulation harder to profit from. The 95/5 subscription split and KICKs tipping are unchanged, and neither report publishes a numeric KPP rate or a calendar day in September for the change — the dates below stay null rather than borrow one.",
      "detected_at": "2026-10-13T03:55:00Z",
      "announced_at": null,
      "effective_at": null,
      "category": "monetization",
      "confidence": "verified",
      "sources": [
        {
          "name": "Streams Charts — Kick revises Partner Program payouts after September errors",
          "url": "https://streamscharts.com/news/kick-revises-kpp-september-2026-update"
        },
        {
          "name": "WIN.gg — Kick admits KPP payment errors",
          "url": "https://win.gg/kick-admits-kpp-payment-errors/"
        }
      ]
    },
    {
      "id": "x-payouts-x-money-2026",
      "platform": "x",
      "title": "X moved U.S. creator payouts from Stripe to X Money on Sept 2 — now the only route for U.S. payouts",
      "summary": "X announced on September 2, 2026 that all U.S. payouts from Original Content Rewards and creator Subscriptions are paid through X Money, its own payments service, instead of Stripe — and confirmed to TechCrunch that the switch is mandatory for U.S. creators, with no other payout option offered. Creators outside the U.S. stay on Stripe. The practical change is timing and custody: a payout is available the moment it is sent, replacing the old Stripe run every two weeks behind a $30 minimum, but the money now lands inside X's own financial product first — X Money is not a bank; its accounts are held at FDIC-insured Cross River Bank. U.S. creators who have not opened X Money need to set it up or their next payout has nowhere to go.",
      "detected_at": "2026-10-13T03:22:00Z",
      "announced_at": "2026-09-02T00:00:00Z",
      "effective_at": "2026-09-02T00:00:00Z",
      "category": "monetization",
      "confidence": "verified",
      "sources": [
        {
          "name": "TechCrunch — X shifts US creator payouts from Stripe to X Money",
          "url": "https://techcrunch.com/2026/09/02/x-shifts-us-creator-payouts-from-stripe-to-x-money/"
        },
        {
          "name": "PYMNTS — X Moves US Creator Payouts From Stripe to X Money",
          "url": "https://www.pymnts.com/commerce/social-commerce/2026/x-replaces-stripe-united-states-creator-payouts/"
        }
      ]
    },
    {
      "id": "fb-link-post-cap-test-2026",
      "platform": "facebook",
      "title": "Facebook's two-link-post test expanded in September: more Pages capped unless they pay for Meta One",
      "summary": "Meta has run this as a test since December 2025, and in September 2026 — as Meta One for Business launched (announced September 15) — managers at more Pages and professional-mode accounts began hitting the cap: two organic posts with external links per calendar month for free, with anything past that shown as plain text rather than a clickable link. Social Media Today reported the expansion on September 17; Press Gazette reported on October 7 that news-publisher Pages are excluded for now, and priced the tiers that lift the cap: $49.99 a month for 8 link posts, $149.99 for 20, $499.99 for unlimited, while the $14.99 Essential tier adds none. Later reporting says links in comments count toward the allowance too. It is still a test, not a rule for every Page — some accounts are capped and others are not — so check your own Page's notice before planning a month of link posts around it.",
      "detected_at": "2026-10-13T02:00:00Z",
      "announced_at": "2026-09-17T00:00:00Z",
      "effective_at": null,
      "category": "policy",
      "confidence": "verified",
      "sources": [
        {
          "name": "Press Gazette — News publishers excluded from new Meta One limits on links",
          "url": "https://pressgazette.co.uk/platforms/facebook-cash-for-links-scheme-excludes-publishers-for-now/"
        },
        {
          "name": "Relevant Audience — Facebook charges Pages for link posts (recapping Social Media Today's September 17, 2026 report)",
          "url": "https://www.relevantaudience.com/meta/facebook-pages-charged-for-link-posts-meta-one/"
        }
      ]
    },
    {
      "id": "tt-smart-plus-creative-selection-2026",
      "platform": "tiktok",
      "title": "TikTok Smart+ Creative Selection pools creator videos into paid ad campaigns (announced Oct 5)",
      "summary": "Announced October 5 at Advertising Week New York and reported the same week by Marketing Dive and MediaPost: Smart+ Creative Selection brings three sources of creative — an advertiser's own assets, Symphony AI-generated video, and creator content — into a single approval workflow for performance campaigns. The system surfaces recommended groups of creative matched to the campaign objective, and the advertiser decides what goes live. What TikTok has not published is the creator side of the terms: no pay rate, no revenue share, and no stated opt-in or opt-out for the creators whose videos enter the pool. Until those terms appear, a creator clip used this way is a usage-rights question — what a brand may do with your video in paid media belongs in your contract, not in an assumption from the announcement.",
      "detected_at": "2026-10-13T02:00:00Z",
      "announced_at": "2026-10-05T00:00:00Z",
      "effective_at": null,
      "category": "monetization",
      "confidence": "verified",
      "sources": [
        {
          "name": "Marketing Dive — TikTok broadens agentic AI play, brings global ad network to US",
          "url": "https://www.marketingdive.com/news/tiktok-broadens-agentic-ai-play-brings-global-ad-network-to-us/832007/"
        },
        {
          "name": "MediaPost — TikTok AI expands search, creative, merchant ad formats",
          "url": "https://www.mediapost.com/publications/article/418523/tiktok-ai-expands-search-creative-merchant-ad-fo.html"
        }
      ]
    },
    {
      "id": "kenya-withholding-platform-payouts-2026",
      "platform": "other",
      "title": "Kenya's 5% withholding now comes off platform payouts — Meta from January, YouTube from September earnings",
      "summary": "The 5% is not a new platform fee: it is Kenya's withholding tax on digital-content income (in law since the Finance Act 2023), and 2026 is the year the platforms began deducting it at source. Meta went first — creators were told in November 2025 that 5% would come off Facebook and Instagram payouts from January 1, 2026, shown on the monthly remittance advice. Google followed for YouTube: 5% off finalised AdSense earnings, starting with September 2026 earnings paid in October, with a verified Kenya Revenue Authority PIN due in AdSense by October 1 or payments are held. TikTok asked Kenyan creators for tax information in mid-September, but has published no rate, start date, or consequence — do not assume the 5% figure or the YouTube deadlines are TikTok's. The withheld amount is an advance against your own tax bill, credited through a withholding certificate, not a second tax on the same income.",
      "detected_at": "2026-10-13T02:00:00Z",
      "announced_at": null,
      "effective_at": null,
      "category": "legal",
      "confidence": "verified",
      "sources": [
        {
          "name": "Tech-ish — TikTok is now asking Kenyan creators for their tax information",
          "url": "https://tech-ish.com/2026/09/16/tiktok-is-now-asking-kenyan-creators-for-their-tax-information/"
        },
        {
          "name": "Dawan Africa — TikTok joins Meta and YouTube as Kenya moves creator taxes into platform payouts",
          "url": "https://www.dawan.africa/news/tiktok-joins-meta-and-youtube-as-kenya-moves-creator-taxes-into-platform-payouts"
        }
      ]
    },
    {
      "id": "meta-bytedance-ad-ban-2026",
      "platform": "facebook",
      "title": "Meta banned TikTok and ByteDance ads on Facebook and Instagram in seven countries (Oct 8)",
      "summary": "From October 8, Meta no longer sells ads or paid marketing messages to ByteDance on Facebook, Instagram, and Threads in the United States, Canada, Egypt, Indonesia, Japan, Thailand, and Vietnam — and the ban reaches third-party advertisers whose campaigns link out to TikTok or other ByteDance properties in those markets. Organic posts and mentions are not covered; this is a paid-promotion rule. Meta's stated reason is that it does not have to run ads for a competitor whose goal is to pull people off its apps. For creators and brands, a paid Meta campaign can no longer be the bridge that sends viewers to a TikTok account in those seven markets — check any cross-platform campaign's destination before it is rejected at review.",
      "detected_at": "2026-10-12T12:00:00Z",
      "announced_at": "2026-10-08T00:00:00Z",
      "effective_at": "2026-10-08T00:00:00Z",
      "category": "policy",
      "confidence": "verified",
      "sources": [
        {